{
  "$schema": "https://echo-ui-automation/schemas/contracts/action/v1",
  "actionId": "detail.saveEdit",
  "source": "user",
  "targetIntent": "MemoryDetailViewModel.saveEdit()",
  "expectedOutcome": "Persist optional title, multiline plain-text description and normalized tags in MemoryUserEdit without overwriting source content; prepare and publish new FTS/representation/vector state before retiring the old version. L4 sync/conflict guards block save and failures keep the old version serviceable (US-AWK-007, ADR-017).",
  "requiresConfirmation": false,
  "version": "1.2.0"
}
