{
  "$schema": "https://echo-ui-automation/schemas/contracts/action/v1",
  "actionId": "prompt.continue",
  "source": "user",
  "targetIntent": "ResumeProgressViewModel.continueTask()",
  "expectedOutcome": "A registered production launcher validates taskType/resumeData and re-enqueues the interrupted task from lastProcessedIndex; missing or stale launchers produce an L2 error and never dismiss as success (US-SYS-001 AC-3)",
  "requiresConfirmation": false,
  "version": "1.1.0"
}
