{
  "$schema": "https://echo-ui-automation/schemas/contracts/action/v1",
  "actionId": "awakening.dismissGeofenceDetail",
  "source": "user",
  "targetIntent": "AwakeningSettingsViewModel.dismissGeofenceDetail",
  "expectedOutcome": "Geofence detail sheet dismissed",
  "requiresConfirmation": false,
  "version": "1.0.0"
}
