{
  "$schema": "https://echo-ui-automation/schemas/contracts/action/v1",
  "actionId": "onboarding.permissionDeny",
  "source": "user",
  "targetIntent": "onboarding.denyPermission",
  "expectedOutcome": "permissions -> permissionDenied state for PhotoKit only; onboarding remains usable and no other system permission request is triggered",
  "requiresConfirmation": false,
  "version": "1.1.0"
}
